Name,Email,Company Name,Job Title,Message from Lead
Sarah Johnson,sarah.johnson@brighttech.io,BrightTech,Head of Operations,"We are scaling fast and struggling with manual internal workflows. Looking for automation tools to reduce overhead. Budget approved and we need to move quickly."
Michael Chen,m.chen@globallogistics.com,Global Logistics Co,VP of Supply Chain,"Our supply chain reporting is fragmented across 5 systems. Need a solution to consolidate data and generate reports automatically. We have a team of 200 and this is a top priority."
Emily Hartmann,emily.h@medfirst.de,MedFirst GmbH,Digital Transformation Lead,"Our hospital group needs to automate patient intake and document management. GDPR compliance is critical. We have budget allocated and a board-level mandate to digitize by Q3."
Rachel Kim,rkim@finwave.io,FinWave,CTO,"We're a fintech building a lending platform for 50,000 users. Need AI-powered credit risk scoring integrated into our pipeline immediately. Engineering team is ready to integrate."
David Nkosi,david.n@bankgroup.za,BankGroup Africa,Head of Innovation,"We're a Tier 1 bank with 2 million customers exploring AI for fraud detection and customer churn prediction. Budget approved. Looking to start a pilot within 30 days."
Laura Schneider,l.schneider@insureco.at,InsureCo,Head of Claims,"We process 3,000 claims monthly and the manual triage is costing us heavily. Need AI to auto-classify and prioritize claims based on urgency. Decision will be made this quarter."
Marcus Webb,m.webb@cybersecpro.co.uk,CyberSec Pro,CISO,"We offer managed security services to 80 enterprise clients. Need an AI assistant that helps analysts triage alerts faster. We have a defined budget and need a solution within 60 days."
Daniel Oluwaseun,d.oluwaseun@agritech.ng,AgriTech NG,CEO,"We connect 10,000 farmers with buyers across West Africa. Need AI to predict crop prices and automate buyer matching. Seed funding secured and ready to invest in tech."
George Papadopoulos,g.papa@shippingmed.gr,ShippingMed,Fleet Manager,"We manage 40 commercial vessels and maintenance costs are spiraling. Need IoT plus AI for predictive maintenance and fuel optimization. This is urgent and budget is confirmed."
Nina Johansson,nina.j@nordicretail.se,Nordic Retail Group,E-commerce Director,"We run 5 e-commerce brands with combined revenue of $30M. Want to unify customer data and automate personalized email campaigns. Looking to sign a contract before end of month."
Hana Kobayashi,hana.k@hrtech.jp,HRTech Japan,HR Director,"We support 200 enterprise companies with recruitment and receive 50,000 CVs monthly. Need AI to screen and rank candidates automatically. This is our top product priority this year."
Robert Langdon,r.langdon@proptech.ca,PropTech Canada,VP Product,"Building a real estate platform targeting $500M in transactions. Want AI features for property valuation and buyer-seller matching. Series A funded and ready to move fast."
Priya Nair,priya.nair@eduhub.in,EduHub India,Product Manager,"Our ed-tech platform serves 50,000 students across 300 schools. Need smarter content recommendation and learning analytics. We have a dedicated tech budget for this quarter."
Omar Shaikh,o.shaikh@retailchain.ae,RetailChain UAE,Chief Digital Officer,"We operate 80 retail stores across the UAE with $100M annual revenue. Need AI-driven inventory forecasting to reduce overstock losses. Board has approved the digital transformation budget."
Amara Dieng,amara.d@telekomaf.sn,TelekomAfrica,Head of Data Analytics,"Our telecom serves 4 million subscribers. We need a churn prediction model urgently as we are losing 8% of customers monthly. Budget confirmed and stakeholders are aligned."
Bruno Ferreira,b.ferreira@logisticspt.com,LogisticsPT,Operations Director,"We handle last-mile delivery for 30 e-commerce brands in Portugal. Delivery failures are costing us contracts. Need route optimization AI immediately. Ready to sign within 2 weeks."
Kavya Reddy,kavya.r@edutech.in,EduTech Solutions,VP Engineering,"We are building an adaptive learning platform for 500 K-12 schools. Need NLP for automated essay grading. Series B funded with a dedicated AI integration budget."
Sophie Laurent,s.laurent@luxuryretail.fr,Maison Laurent,Head of CRM,"We are a luxury fashion house with 200,000 high-value clients globally. Need AI personalization for VIP customer journeys. This is a strategic priority approved at CEO level."
James Okafor,j.okafor@novanet.ng,NovaNET Africa,IT Director,"We want to digitize operations across 3 branches and integrate all systems via API. We have a clear technical roadmap and the CTO has signed off on the budget for this year."
Fatima Diallo,fatima.d@microfinance.sn,MicroFinance Senegal,Operations Lead,"We provide loans to 5,000 SMEs and managing repayments manually is unsustainable. Need a CRM that handles loan tracking and client communication. Ready to implement within 90 days."
Aisha Patel,aisha@startupboost.co,StartupBoost,Founder,"Just launched our startup six months ago. Exploring affordable tools to manage leads and automate customer follow-ups. We are early stage so budget is limited but growing fast."
Carlos Rivera,crivera@buildpro.mx,BuildPro Mexico,Project Manager,"Looking for project tracking software for our construction projects. We currently use spreadsheets and it gets messy sometimes. Would like to explore options when we have time."
Yusuf Al-Farsi,yusuf@smartgulf.ae,SmartGulf Tech,Business Development Manager,"We resell SaaS tools across the GCC region. Looking for a white-label solution we can offer clients. Still in early discussions internally about whether this fits our roadmap."
Mei Lin,mei.lin@fashionai.cn,FashionAI,Growth Lead,"We are a fashion startup using AI for trend prediction. Want to integrate your API into our dashboard at some point. Not urgent but wanted to learn more about your capabilities."
Chioma Eze,chioma@healthconnect.ng,HealthConnect,Co-founder,"We connect patients to doctors in rural Nigeria. Need an AI triage chatbot eventually. We are pre-revenue right now and exploring grant funding to cover technology costs."
Tom Brennan,tom@smallshop.ie,Small Shop Ltd,Owner,"Just a small retail store with 2 employees. Browsing to see what tools are out there. Not sure if we can afford anything right now to be honest."
Alex Thompson,alex.t@freelance.com,Self-employed,Freelancer,"Just browsing to see what tools are out there. No specific need right now. Maybe something useful in the future."
Sonia Gutierrez,sonia@marketingplus.co,MarketingPlus,Account Director,"We run campaigns for some brands. Curious about AI copywriting tools. No immediate project lined up but might be useful down the line."
Luis Morales,luis.m@solar360.cl,Solar360,Sales Director,"We sell solar installations to small businesses. Interested in a CRM with lead scoring. Still evaluating options and comparing prices. No decision timeline yet."
Ananya Roy,ananya.roy@legalai.in,LegalAI India,Co-founder,"We are building AI for contract review. Just wanted to know more about your NLP capabilities out of curiosity. No specific integration plan at the moment."
